{
  "success": true,
  "filename": "DACP_Avionic_Panel.pdf",
  "page_count": 2,
  "raw_text_length": 2180,
  "title_block": {
    "part_number": "DACP-AV-002",
    "drawing_number": "DACP-AV-002-REV-B",
    "material": "Al 6061-T6 Alüminyum",
    "hardness": "95 HB",
    "roughness": "Ra 0.8 µm",
    "general_tolerance": "ISO 2768-mK"
  },
  "datums": ["A", "B", "C"],
  "dimensions": [
    {
      "id": 1,
      "balloon": "#1",
      "type": "DIAMETER",
      "type_label": "Montaj Deliği (Pin Hole)",
      "icon": "⭕",
      "nominal": 6.0,
      "nominal_str": "Ø6.000 H7 (+0.012/0)",
      "upper_tol": "+0.012",
      "lower_tol": "0.000",
      "measured": "6.003 mm",
      "deviation": "+0.003 mm",
      "status": "PASS",
      "feature_key": "bore_pin_6",
      "gdt": "⌖ Ø 0.015 | A | B | C",
      "bbox": [150, 220, 210, 270]
    },
    {
      "id": 2,
      "balloon": "#2",
      "type": "LINEAR",
      "type_label": "Panel Genişliği",
      "icon": "📏",
      "nominal": 120.0,
      "nominal_str": "120.00 ±0.10 mm",
      "upper_tol": "+0.100",
      "lower_tol": "-0.100",
      "measured": "120.045 mm",
      "deviation": "+0.045 mm",
      "status": "PASS",
      "feature_key": "panel_width_120",
      "gdt": "⏢ 0.020",
      "bbox": [50, 450, 550, 500]
    }
  ]
}
